"Name","Synopsis","Severity"
"Azure.VM.Standalone","Single instance VMs are a single point of failure, however reliability can be improved by using premium storage.","Important"
"Azure.VM.Updates","Ensure automatic updates are enabled at deployment.","Important"
"Azure.VM.UseHybridUseBenefit","Use Azure Hybrid Benefit for applicable virtual machine (VM) workloads.","Awareness"
"Azure.VM.UseManagedDisks","Virtual machines (VMs) should use managed disks.","Important"
"Azure.VMSS.AMA","Use Azure Monitor Agent for collecting monitoring data from VM scale sets.","Important"
"Azure.VMSS.AutoInstanceRepairs","Applications or infrastructure relying on a virtual machine scale sets may fail if VM instances are unhealthy.","Important"
"Azure.VMSS.AvailabilityZone","Deploy virtual machine scale set instances using availability zones in supported regions to ensure high availability and resilience.","Important"
"Azure.VMSS.ComputerName","Virtual Machine Scale Set (VMSS) computer name should meet naming requirements.","Awareness"
"Azure.VMSS.MigrateAMA","Use Azure Monitor Agent as replacement for Log Analytics Agent.","Important"
"Azure.VMSS.Name","Virtual Machine Scale Set (VMSS) names should meet naming requirements.","Awareness"
"Azure.VMSS.PublicIPAttached","Avoid attaching public IPs directly to virtual machine scale set instances.","Critical"
"Azure.VMSS.PublicKey","Use SSH keys instead of common credentials to secure virtual machine scale sets against malicious activities.","Important"
"Azure.VMSS.ScriptExtensions","Custom Script Extensions scripts that reference secret values must use the protectedSettings.","Important"
"Azure.VMSS.ZoneBalance","Deploy virtual machine scale set instances using the best-effort zone balance in supported regions.","Important"
"Azure.VNET.BastionSubnet","VNETs with a GatewaySubnet should have an AzureBastionSubnet to allow for out of band remote access to VMs.","Important"
"Azure.VNET.FirewallSubnet","Use Azure Firewall to filter network traffic to and from Azure resources.","Important"
"Azure.VNET.FirewallSubnetNAT","Zonal-deployed Azure Firewalls should consider using an Azure NAT Gateway for outbound access.","Awareness"
"Azure.VNET.LocalDNS","Virtual networks (VNETs) should use DNS servers deployed within the same Azure region.","Important"
"Azure.VNET.Name","Azure Resource Manager (ARM) has requirements for Virtual Network names.","Awareness"
"Azure.VNET.Naming","Virtual Networks without a standard naming convention may be difficult to identify and manage.","Awareness"
"Azure.VNET.PeerState","VNET peering connections must be connected.","Important"
"Azure.VNET.PrivateSubnet","Subnets that allow direct outbound access to the Internet may expose virtual machines to increased security risks.","Critical"
"Azure.VNET.SingleDNS","Virtual networks (VNETs) should have at least two DNS servers assigned.","Important"
"Azure.VNET.SubnetName","Azure Resource Manager (ARM) has requirements for Virtual Network Subnet names.","Awareness"
"Azure.VNET.SubnetNaming","Virtual Network subnets without a standard naming convention may be difficult to identify and manage.","Awareness"
"Azure.VNET.UseNSGs","Virtual network (VNET) subnets should have Network Security Groups (NSGs) assigned.","Critical"
"Azure.VNG.ConnectionName","Virtual Network Gateway (VNG) connection names should meet naming requirements.","Awareness"
"Azure.VNG.ConnectionNaming","Virtual network gateway connections without a standard naming convention may be difficult to identify and manage.","Awareness"
"Azure.VNG.ERAvailabilityZoneSKU","Use availability zone SKU for virtual network gateways deployed with ExpressRoute gateway type.","Important"
"Azure.VNG.ERLegacySKU","Migrate from legacy SKUs to improve reliability and performance of ExpressRoute (ER) gateways.","Critical"
"Azure.VNG.MaintenanceConfig","Use a customer-controlled maintenance configuration for virtual network gateways.","Important"
"Azure.VNG.Name","Virtual Network Gateway (VNG) names should meet naming requirements.","Awareness"
"Azure.VNG.Naming","Virtual network gateway without a standard naming convention may be difficult to identify and manage.","Awareness"
"Azure.VNG.VPNActiveActive","Use VPN gateways configured to operate in an Active-Active configuration to reduce connectivity downtime.","Important"
"Azure.VNG.VPNAvailabilityZoneSKU","Use availability zone SKU for virtual network gateways deployed with VPN gateway type.","Important"
"Azure.VNG.VPNLegacySKU","Migrate from legacy SKUs to improve reliability and performance of VPN gateways.","Critical"
"Azure.vWAN.Name","Virtual WAN (vWAN) names should meet naming requirements.","Awareness"
"Azure.WebPubSub.ManagedIdentity","Configure Web PubSub Services to use managed identities to access Azure resources securely.","Important"
"Azure.WebPubSub.SLA","Use SKUs that include an SLA when configuring Web PubSub Services.","Important"
